{
    "$schema": "http://127.0.0.1/Config.schema.json",
    "calendars": {
        "t1": {
            "courses": [
                {
                    "nameFilter": "Eng",
                    "warn": "never"
                },
                {
                    "nameFilter": "Mat",
                    "warn": "never"
                }
            ],
            "accumulate": false,
            "source": "hh5849@stundenpla.hamburg.de",
            "update": "onDemand"
        }
    },
    "updateCycle": [
        "00:30",
        "06:30",
        "07:00",
        "07:15",
        "07:30",
        "07:45",
        "08:00",
        "09:00",
        "10:00",
        "11:00",
        "12:00",
        "14:00",
        "16:00",
        "18:00",
        "20:00",
        "22:00"
    ],
    "loging_email": "robin@kock-hamburg.de",
    "server_port": 8030,
    "server_prefixes": [
        "http://localhost:\\p/",
        "http://localhost:8080/"
    ]
}